Title,Description,Channel Title,Publish time,Tags,Category,Duration,Number of comments,Number of likes,Number of views,Number of favorites,Video quality,Licensed
La vie des People - Andy,"Un guide non exhaustif de ce qu'il faut faire pour être un people qui se respecte!
Je me dis qu'etre un people, au quotidien ca doit etre absolument horrible, non? Non? Ok.

Suis moi sur Facebook ! http://www.facebook.com/andyraconte
Twitter :   @andyrowski
Et sur Insta ! @andyrowski
Et NOOON je n'ai pas Snapchat ;) (Ni d'autres comptes ailleurs)",ANDY,2013-04-24T16:44:38Z,"['andy raconte', 'andyraconte', 'andyracontesavie', 'andy raconte sa vie', 'andy podcast', 'andy vidéos', 'podcast fille', 'humour', 'video youtube', 'video humour', 'etre un people', 'etre une star', 'devenir une star', 'devenir un people', 'télé realité', 'tv réalité', 'geni g', 'hollywood girls', 'actu people', 'paparazzis', 'célébrité', 'comment devenir une star']",23,5:26,1356,58592,4630468,0,hd,True
Si Barbie était vivante - Andy,"Suis moi sur Facebook ! http://www.facebook.com/andyraconte
Twitter :   @andyrowski
Et sur Insta ! @andyrowski
Et NOOON je n'ai pas Snapchat ;) (Ni d'autres comptes ailleurs)",ANDY,2013-04-07T15:28:08Z,"['andy raconte', 'andyraconte', 'andyracontesavie', 'andy raconte sa vie', 'andy podcast', 'andy vidéos', 'vidéo', 'youtube', 'barbie', 'si barbie était vivante', 'vraie barbie', 'barbie réelle', 'humour', 'rire']",23,5:19,4741,209547,14828635,0,hd,True
