Title,Description,Channel Title,Publish time,Tags,Category,Duration,Number of comments,Number of likes,Number of views,Number of favorites,Video quality,Licensed
Escape - Andy,"Sortie de DEATH ESCAPE disponible maintenant en librairies ! 
Pour le commander en ligne :
https://amzn.to/2I1yLVQ
http://tidd.ly/8669c7a8
Lien pour l'aide au livre (bande de tricheurs 🤫) : https://www.lisez.com/9791032403570 (dans ""contenu additionnel"")

Suis-moi sur Insta et TikTok : @andyrowski 

Merci à Studio71 pour la vidéo ! Ainsi qu'à Estelle Fitz (Anna), Axel Mandron (Djibril), Manon Tissier (Lise) et Laëticia Dufourd (Haïssa) pour leur participation, j'ai rarement eu une aussi bonne ambiance sur un tournage donc merci à tous !

Un gros bisou à toi qui lit la description jusqu'au bout, t'es un vrai !",ANDY,2020-06-21T16:00:25Z,"['andy', 'andy rowski', 'andy raconte', 'livre', 'roman', 'escape game', 'escape room', 'estelle fitz', 'axel mandron']",23,9:5,881,98557,1173547,0,hd,True
Le Bar des Morts - Andy,"Bienvenue dans le Bar des Morts ! Le seul endroit où les gens ne sont pas en confinement parce que, ben...
Ils sont morts. 

Merci à Studio71 pour la prod et à Franck Marchand pour la réalisation ! Tous les crédits sont dans la fin de la vidéo :)

Tu peux aussi me rejoindre sur insta : @andyrowski
Et si vraiment t'es sympa tu peux également t'abonner ! (Oui rhooo je suis pas régulière et ça fait 3 mois que je n'avais pas fait de vidéo et alors ? Only God can judge me ! C'est à cause du confinement, je peux plus écrire parce que mon ordi a un virus et je ... ouaiiis bon ok, je prépare la relève, masse de vidéos mais sur un tout autre thème...Ca va arriver ! doucement mais surement ;) )

Bisous les meilleurs !",ANDY,2020-03-31T15:51:04Z,[],23,10:4,609,91489,1199100,0,hd,True
Télé Cliché - Andy,"Si t'as passé les deux derniers mois à regarder les films de Noël à la télé, cette vidéo est pour toi !  (Mais ne regarde pas la fin alors, ça risquerait de briser tes rêves.)
Dites moi en commentaires les plus gros clichés des films de Noël, pour voir si j'en ai oublié !

Merci à David Ben (il à une chaine Youtube si vous voulez aller checker :) , à Kévin Duforest, Sacha Vanbockestal, Julien Ratel, Newton et Marie Coustaury pour leur participation et leur bonne humeur ! C'était un des tournages les plus cool que j'ai fait depuis le début de ma chaine et j'espère que ça se ressent !

Et merci à Studio71 pour la prod :)

Tu peux me suivre sur insta @andyrowski et Facebook (Facebook.com/andyraconte)

Bisous et bonnes fêtes de fin d'année ! ;)",ANDY,2019-12-22T17:00:02Z,"['andy', 'andy rowski', 'andy raconte', 'clichés de Noël', 'film de Noël', 'téléfilm de Noël']",23,6:54,1022,134830,1866096,0,hd,True
La copine parfaite - Andy,"Et toi, tu l'utiliserais cette machine ? 
Non parce que j'ai un petit code promo pour vous avoir 20% dessus si ça vous branche ! 
(Non)
Mais merci à Nino Arial : https://www.youtube.com/channel/UC_3PmpXhpgfBXuFHWaTrTfA

et à Ugo Marchand : https://www.youtube.com/user/JCVandale/videos

...pour avoir été mes guests ! Et a Studio71 pour la prod :)

Tu peux me suivre sur insta @andyrowski et Facebook (Facebook.com/andyraconte)
Tu peux aussi t'abonner ca te débloquera le code promo de 20%
(toujours faux)
(mais tu peux quand même t'abonner)

Bisous et à très vite ! ;)",ANDY,2019-10-17T16:45:03Z,"['andy', 'andy rowski', 'andy raconte', 'nino arial', 'ugo marchand', 'copine parfaite']",23,7:45,1254,233309,4890957,0,hd,True
Les 90's VS Aujourd'hui - Andy,"Si tu as vécu pendant cette période, c'est quoi tes souvenirs ?

Pour tous les nostalgiques, les 80's et 90's babies, ou les millenials qui sont curieux de savoir comment on survivait sans internet à l'époque, petit retour en arrière !
J'avais envie de faire cette vidéo depuis longtemps alors merci à l'équipe qui m'a permis de faire ce petit saut dans le temps :)

Fais ta B.A de la journée et suis-moi sur insta ! @andyrowski

Merci à Nadia Richard  (Utile Futile) https://www.youtube.com/channel/UCRXvTfwctBJlkaJ3MbsPf8w

Et à Alix Gavoille http://www.instagram/com/alixgavoille

ET à Studio71 pour la production !

Surtout merci à toi d'être là !! 

Ah si c'est pas déjà fait tu peux t'abonner tout ça tout ça, n'oublies pas de mettre la cloche pour que tu saches quand je poste une vidéo, ça t'éviteras de te demander si j'ai arrété les vidéos (Réponse : Non. pas prévu!)

A dans un mois! ;)",ANDY,2019-09-12T16:01:06Z,"['andy', 'andy raconte', 'andy rowski', ""90's"", '90s', 'nineties', 'nadia richard', 'alix gavoille']",23,5:7,1227,161477,2864673,0,hd,True
Réussir son couple - Andy,"Merci à Andy d'avoir posté cette vidéo sur sa chaine pour nous faire de la publicité, non pas que nous en ayons besoin mais on va pas cracher dessus ! 

Comme on est cool on va lui faire de la pub aussi !

Merci à Eddie Cudi :  https://www.youtube.com/channel/UCyi7HBZoO__2j9S0hJvF_PQ

A Tibo InShape : https://www.youtube.com/user/OutLawzFR

A JujuFitCats : https://www.youtube.com/channel/UCIPbzkl1kZ_9Gyuph_FGvzg

et à Axel Prin à la réal et a Studio71 pour la prod !

Tu peux suivre Andy sur instagram : @andyrowski

Et lâcher un petit pouce bleu si tu veux nous revoir sur sa chaine ! Et puis tu peux aussi t'abonner à sa chaine, ca nous fera de la visibilité, et toute visibilité, bonne ou mauvaise est bonne à prendre ! 
On vous aime nos petits koalas ! 
Bisous de Malaisie !

Léna et Steven.",ANDY,2019-07-25T16:00:14Z,"['andy', 'andy rowski', 'andy raconte', 'lena et steven', 'réussir son couple', 'powercouple', 'couplegoals', 'instagram', 'amour']",23,11:2,1110,181234,3033519,0,hd,True
Comment s'inventer une vie - Andy,"Tu n'as aucune vie sociale ? Pas de panique, cette vidéo est faite pour faire croire que tu en as une ! Méthode testée et approuvée ( par nous)
ATTENTION : Dans certains cas ces conseils peuvent entraîner à une perte totale de vie sociale. Nous travaillons chaque jour à améliorer notre méthode et nous sommes à votre écoute dans les commentaires pour nous suggérer d'autres techniques pour s'inventer une vie.

Tu peux me suivre sur insta ici : @andyrowski
(Ou sur facebook et twitter mais je ne poste plus, c'est comme tu veux brefff)

Merci à toute l'équipe de m'avoir aidée à faire cette vidéo ! 

Bisous, j'vous kiffe, merci d'être là !",ANDY,2019-06-13T16:00:10Z,"['Andy rowski', 'andy raconte', 'reseaux sociaux', 'humour', 'podcast', 'tuto']",23,5:32,1442,183111,2798350,0,hd,True
Les Loups-Garous - Andy,"Cette vidéo est bien entendu inspirée de mon jeu de prédilection ""les loups-garous de Thiercelieux"" 
...Et non ce n'est pas un placement de produit - malheureusement !- :p 

Pour ceux qui n'y ont jamais joué j'espère que vous ne serez pas trop perdus et si c'est le cas, go apprendre les règles ( ca vous servira toujours ) :  http://jeuxstrategie.free.fr/Loups_garous_complet.php

Merci à Guillaume Pley, Satine Wallé, Prince, DearCaroline et Joyca pour leur participation, ainsi qu'à Martine Borg, Nicolas de Lavergne, Arnaud Gerard, Axel Prin, Romain Safars, Yannick Wallon et Johan Fontic qui s'est bien fait bouffer par les loups-garous ! 

Merci aussi à toute l'équipe technique sans qui cette vidéo n'aurait pas été possible !
Merci au soleil qui s'est couché beaucoup trop vite ! 
Merci au Domaine de la Geneste pour le lieu et cet accueil au top ! (même lieu que ma vidéo d'Halloween So Andy pour les vrais ! ;) )
Merci à Kim Marc Huynh pour l'étalo et Franck Marchand pour la réal ! :)

Merci à vous de me soutenir et d'être là...

Si ce n'est pas déjà fait, tu peux t'abonner, lâcher un petit pouce bleu parce que ça fait toujours plaisir ! Et me suivre sur insta, j'y suis BEAUCOUP plus active ;) @andyrowski

A très vite pour la prochaine !",ANDY,2019-05-09T16:00:50Z,"['andy rowski', 'andy raconte', 'loups garous', 'loups garous de thiercelieux', 'guillaume pley', 'satine wallé', 'dear caroline', 'joyca', 'prince']",23,8:1,2582,161658,2440622,0,hd,True
A VOUS DE CHOISIR ! - Andy,"""La pire soirée de ta vie"", sortie le 4 Avril, à commander ici : 
https://amzn.to/2JkEAi0
http://tidd.ly/64809734

J'avais envie de faire un livre d'horreur depuis longtemps, mais la peur étant difficilement transmissible à l'écrit, je me demandais comment faire pour que ça puisse être efficace. Etant une énorme adepte de cinéma d'horreur, j'ai une tolérance à la peur beaucoup trop élevée, par contre je suis incapable de me poser devant un jeu vidéo d'horreur...Et ça, c'est parce que c'est moi qui doit tout gérer...
C'est là que m'est venue l'idée de faire un livre d'horreur dont vous êtes le héros. Et là, c'est vous qui allez devoir gérer !
Il y'a 11 fins et plusieurs histoires possibles, certaines plus flippantes que d'autres, à vous de faire les bons choix..... ;)
J'ai commencé à développer les personnages, le lieu, les différentes histoires possibles il y'a un an et demi, mais à ce moment là j'avais tellement l'impression d'attirer des choses bizarres dans ma vie ( dans mon appart' surtout ...) que j'ai dû faire une pause, pour reprendre cet été.
J'ai vraiment hyper hâte d'avoir vos retours dessus, de savoir quelle fin vous avez eue, et j'ai hâte de vous voir à la dédicace !

Merci à TOUTE l'équipe qui a participé à cette vidéo ! Les crédits sont dans le générique de fin, y'en a beaucoup trop mais je les aime tous autant ! 

Si ca te dit de me suivre sur les réseaux,  c'est par ici:
FB et Insta : @andyrowski
Tu peux sur Twitter aussi mais bon, j'ai pas update depuis un an ^^

Bisous, coeur coeur et revenants 💀",ANDY,2019-03-29T17:00:41Z,[],23,7:23,1660,128812,2030718,0,hd,True
Digital Detox - Andy,"Quand tu penses que c'était notre vie avant, qu'on en vivait très bien et que maintenant on frôlerait la 3eme guerre mondiale...

Si ca te dis de me suivre sur les réseaux, attention le pseudo a changé depuis un an, c'est par ici:
Insta : @ andyrowski     http://instagram.com/andyrowski
FB : @andyrowski     http://facebook.com/andyraconte
Tu peux sur Twitter aussi mais bon, j'ai pas update depuis un an ^^

Merci à TOUTE l'équipe habituelle qui a fait un taf de dingue encore une fois !

Si tu n'avais que ça à faire de ta journée de lire cette description alors n'hésites pas à commenter un petit coeur dans mes commentaires, ça fait toujours plaisir ;)

Bisous!",ANDY,2019-01-11T17:00:02Z,"['andy', 'andyraconte', 'andy rowski', 'digital detox', 'humour', 'court métrage', 'smartphone', 'internet', 'réseaux sociaux']",23,8:18,1397,136445,2187371,0,hd,False
Love Note - Andy,"Voilà, quand on me fait confiance et qu'on me met une arme de destruction massive dans les mains.

Si ca te dis de me suivre sur les réseaux, attention le pseudo a changé depuis un an, c'est par ici:
Insta : @ andyrowski     http://instagram.com/andyrowski
FB : @andyrowski     http://facebook.com/andyraconte
Tu peux sur Twitter aussi mais bon, j'ai pas update depuis un an ^^

Merci à TOUTE l'équipe habituelle qui a fait un taf de dingue encore une fois !

Si tu n'avais que ça à faire de ta journée de lire cette description alors n'hésites pas à commenter un petit coeur dans mes commentaires, ça fait toujours plaisir ;)

Bisous!",ANDY,2018-11-23T17:00:20Z,"['andy rowski', 'andy raconte', 'sketch', 'couple', 'amour', 'love note', 'death note', 'court metrage']",23,8:18,2826,193120,3517878,0,hd,False
Les mauvaises habitudes - Andy,"A tous ces gens qui nous font attendre 45 minutes à se les geler devant un resto, qui t'envoient un ""j'arrive"" alors qu'ils sont encore dans leur lit, qui te disent que leur métro est en retard, ou même ceux qui oublient de se réveiller pour venir a ta soirée (coucou Léo).
Je vous déteste :) Et je vous dédie cette vidéo !
Cordialement, la team Toujours 10 minutes d'avance.
T'es quelle team toi?

Si ca te dis de me suivre sur les réseaux, attention le pseudo a changé depuis un an, c'est par ici:
FB et Insta : @andyrowski
Tu peux sur Twitter aussi mais bon, j'ai pas update depuis un an ^^

Merci à TOUTE l'équipe qui a participé à cette vidéo ! Les crédits sont dans le générique de fin ;)",ANDY,2018-10-12T16:00:09Z,"['andy', 'andy raconte', 'andy rowski', 'retard', 'anthony dupray', 'mauvaise habitude']",23,5:26,1385,165958,3573936,0,hd,False
Le Musée des Ex - Andy,"Prière de bien vouloir inventer cet endroit pour nous faire gagner du temps en matière de stalking de feed instagram, merci.

Merci à TOUTE l'équipe qui a participé à cette vidéo ! Les crédits sont dans le générique de fin, y'en a beaucoup trop mais je les aime tous autant ! 

Si ca te dis de me suivre sur les réseaux, attention le pseudo a changé depuis un an, c'est par ici:
FB et Insta : @andyrowski
Tu peux sur Twitter aussi mais bon, j'ai pas update depuis un an ^^

Pourquoi j'ai été absente pendant 9 mois ? 
Bah 9 mois.
A ton avis....
...
...

Non j'déc. Mais on repart sur de bonnes bases avec toute cette équipe de choc pour vous faire de belles fat vidéos tous les mois, OUI OUI ! 

Si tu es encore en train de lire cette description, déjà bravo à toi, ensuite dis moi en commentaire ta meilleure version de ""retourner avec son ex c'est comme....."" ;)

Bisous j'vous aime !",ANDY,2018-08-31T16:03:25Z,"['andy', 'andy rowski', 'andy raconte', 'franck marchand', 'shera kerienski', 'hally', 'shiu li', 'nadia richard', 'nad rich hard', 'amour', 'couple', 'ex', ""retourner avec son ex c'est comme ravaler son vomi""]",23,8:13,4768,322103,7985345,0,hd,False
Si on pouvait tout contrôler - Andy,"Je regrette un peu d'avoir fait cette vidéo parce que du coup j'aimerais bien que ça existe vraiment...-_- Sauf pour les boobs, là c'était abusé. Ou pas.

Merci à Raphael Sartoris pour la réalisation, au top :)
Merci à mon chéri d'un jour Kim Tassel (@kim_tassel)
A ma copine de plus d'un jour Armelle Gerbault (@armellishous)
A Yoan Sintive qui sait mettre un coup de pression a un taré en 2 secondes 
Et à Sebastien Fanet et Jean Masini !

Et bien entendu un gros merci aux Sims qui m'ont donné la possibilité de faire cette vidéo !

Abonne toi c'est gratuit ;) Pour une fois que quelque chose est gratuit sérieux ça serait con de louper ça ! 

Suis moi sur Facebook ! http://www.facebook.com/andyraconte
Twitter :   @andyrowski
Et sur Insta ! @andyrowski
Et NOOON je n'ai pas Snapchat ;) (Ni d'autres comptes ailleurs)

Bisous et à dans 3 mois, ou 4 ou 6 ! 0:-)",ANDY,2017-12-08T17:00:02Z,"['andy', 'andy rowski', 'andyrowski', 'andy raconte', 'sims', 'sims4']",23,4:51,1133,300923,8038104,0,hd,True
J'suis pas jalouse (CLIP) - Andy,"En fait j’aurai pu intituler cette vidéo ""Si une chieuse se présentait à The Voice » moyen de gagner x1000…

Voilà, après Natoo, Norman, Squeezie ( oh mon Dieu elle fait comme les autres c'est abusé! ) trop contente de pouvoir vous présenter mon clip - que j’ai eu l’occasion de faire pour l’édition de Just Dance 2018 -  !! J‘ai voulu rester dans le thème de ma chaine et vous pourrez sûrement reconnaître cette fameuse chieuse en couple ! 
C’est bien sûr une chanson à ne pas prendre au sérieux  … Un sketch mis en chanson quoi :)

Tu peux t’abonner, c’est toujours aussi gratuit, et me suivre sur :
Insta - Facebook - Twitter : @andyrowski

Je remercie Guillaume Pley qui a eu le courage de jouer mon chéri. Parce que c’est pas tous les jours facile.
Merci à Waxx et Matthieu Joly pour la musique, vous êtes géniaux
Merci à Alicia Sissta pour avoir écrit les paroles avec moi…On s’en rappellera de cette rime en  ""i""
Merci à Matthieu Allard et à IDZ pour la mise en place du clip et ces décors au top ! Vous ne décevez jamais !
Merci aux danseuses Olivia @olivecrbs, Fanny @Frenchtouch_nyc, Laura @LauraGiacalone et Elisa @Elisabtls qui ont été super !
Merci à Ubisoft et a Just Dance de m’avoir fait confiance à vos risques et périls !

...Et merci à vous d’être toujours là :coeur:

Au passage, si un jour vous voulez faire une soirée karaoké, ou que vous voulez faire passer un message a votre mec, je vous cale les paroles ici :

Non j’n’attends pas que tu me
Passes la bague au doigt
Chéri, file moi tous tes mots de passe
Ca suffira
Mais non j’te traque pas
J’m’intéresse à toi
Ca fait 32 fois que je t’appelle
Pourquoi tu réponds pas ?

Quand je te dis je t’aime
Tu me dis merci
Dans mon cœur t’es mon Jon Snow
Dans le tien je suis Cersei
Je t’enlace, tu me fuis
Tu me bloques ? J’te détruis !

Regarde Moi Moi Moi Moi
Les autres ils n’existent pas
Moi je suis La La La La
Oublie tes soirées
Tes potes dégage les
Regarde Moi Moi Moi
Les autres ils ne t’aiment même pas
Moi je suis La La La La
Fini de draguer
Tes ex sous mon nez

J’irai te stalker, te filmer
Jusqu’aux toilettes
J’ai dfini tes jeux vidéos
A coup de machette
J’ai bloqué tous les appels
Des morues de ton tel
Toutes ces meufs que t’as liké
C’était moi photoshopée

N’essaie pas de partir
T’es venu me chercher
Tes potes ont disparu
Parce que j’les ai soudoyés
T’en peux plus ? J’vais continuer
T’es vaincu ? J’ai gagné !

Refrain 

Après le premier rendez vous
J’avais déjà ma robe de mariée
He bah retourne chez ta mère
Y’a qu’elle qui peut te saquer

Regarde Moi Moi Moi Moi
Je n’suis plus La La La La
Regarde moi Moi Moi Moi
Les autres sont tellement mieux que toi
Je n’suis plus La La La La
Fini de draguer
Tes exs sous mon nez

(Tu pourras te la péter dans les dîners mondains maintenant)
Bisous !",ANDY,2017-10-19T17:08:07Z,"['andy', 'andy raconte', 'andy rowski', 'guillaume pley', 'clip', 'chieuse', 'jalousie', 'couple']",23,3:1,1491,243247,8843723,0,hd,True
Si ces héroïnes pouvaient exister - Andy,"Voilà, si Hollywood veut me piquer cette idée, c'est cadeau . Je verrais bien Ryan Gosling dans le second rôle. Avec plein de scènes debaisers. 
Quoi y'a que des rôles de meufs ? Déjà c'est hypersexiste de penser ça et même si tu l'as pas pensé, gna gna gna j'ai rien d'autre à dire. 

*************

EEEET si tu veux gagner des places avec @orange pour découvrir Valerian ( ui ui le film avec Cara ), lors de l'avant-première à Paris le 25 Juillet, je te conseille fortement (c'est même obligé sinon tu peux pas gagner, bref dommage quoi...) de te connecter ici  :

Valérian.orange.com 

Bonne chance ! :)

********************
Abonne toi c'est gratuit ;) Pour une fois que quelque chose est gratuit sérieux ça serait con de louper ça ! 

Suis moi sur Facebook ! http://www.facebook.com/andyraconte
Twitter :   @andyrowski
Et sur Insta ! @andyrowski
Et NOOON je n'ai pas Snapchat ;) (Ni d'autres comptes ailleurs)",ANDY,2017-07-15T16:00:02Z,"['Ryan Gosling', 'Andy', 'Hollywood', 'cinema']",23,4:1,230,183075,5280847,0,hd,True
Quand t'es pas sociable - Andy,"Quand t'es asocial, insociable, ""socially awkward"", complètement reclus, agoraphobe, que t'as un le syndrome du resting bitch face, ou que t'aimes juste pas les gens.
Abonne toi c'est gratuit ;) Pour une fois que quelque chose est gratuit sérieux ça serait con de louper ça ! 

Suis moi sur Facebook ! http://www.facebook.com/andyraconte
Twitter :   @andyrowski
Et sur Insta ! @andyrowski
Et NOOON je n'ai pas Snapchat ;) (Ni d'autres comptes ailleurs)

Merci à Alendra (@alendrascloset sur Insta) et Jonathan (@citycarts sur Insta) les 2 seuls à être aussi asociaux que moi, parce que ""j'aime les gens qui aiment pas les gens"" :)

Beusouuuuuus !!!!",ANDY,2017-05-27T16:00:01Z,"['andy', 'andyraconte', 'asocial', 'insociable', 'vidéo', 'humour', ""j'aime pas les gens""]",23,3:46,2824,345645,8164768,0,hd,True
Tinder Cop - Andy,"Quand t'as passé trop de temps sur Tinder et que dans ta tête tu te fais des films. Littéralement. 

Musique : Rad Trumpet - JDR https://www.youtube.com/watch?v=bnG7f1kpTaU

Abonne toi c'est gratuit ;) Pour une fois que quelque chose est gratuit ça serait con de louper ça ! 

Suis moi sur Facebook ! http://www.facebook.com/andyraconte
Twitter :   @andyrowski
Et sur Insta ! @andyrowski
Et NOOON je n'ai pas Snapchat ;) (Ni d'autres comptes ailleurs)
Et si t'as rien compris à la vidéo parce que tu connais pas Tinder et que tu cherches un plan tête sans prise de cul (ou pas, mais ca ne nous regarde pas) : http://go.tinder.com/AndyRacontePourTinder

Merci à Ludoc pour cette vidéo et de prouver qu'on peut faire de la qualité sur Youtube et à Tinder pour l'opportunité de faire une telle vidéo sur ma chaine ! Et à chaque personne qui y a contribué bien sûr ! Coeur bisous coeur je vous swipe sur la droite !",ANDY,2017-04-21T16:00:16Z,"['andy', 'andyraconte', 'tinder', 'tindercop', 'ludoc', 'nico berno']",23,5:8,990,174109,4144288,0,hd,True
Quand tu kiffes quelqu'un - Andy,"...et que t'es psychopathe ( ou juste un(e) simple stalker )


Abonne toi c'est gratuit ;) Pour une fois que quelque chose est gratuit sérieux ça serait con de louper ça ! 

Suis moi sur Facebook ! http://www.facebook.com/andyraconte
Twitter :   @andyrowski
Et sur Insta ! @andyrowski
Et NOOON je n'ai pas Snapchat ;) (Ni d'autres comptes ailleurs)

Merci à Sylvain (@sylvainvonk sur Insta) et Mikael (@mikamaoui sur Insta)

Beusouuuuuus !!!!",ANDY,2016-12-02T17:00:05Z,"['andy', 'andy raconte', 'relations', 'stalker', 'amour', 'je sais meme pas si ca sert a quelque chose les mots clés bordel']",23,4:43,1176,305275,11338184,0,hd,True
Le code des profs - Andy,"Si t'as un doute sur un de tes profs, c'est sûrement comme ça qu'il l'a eu !

Abonne toi!  De 1 c'est gratuit et de 2 tu payes pas

Viens aussi me suivre! 
Sur Facebook ! http://www.facebook.com/andyraconte
Twitter :   @andyrowski
Et sur Insta ! @andyrowski
Et NOOON je n'ai pas Snapchat ;) (Ni d'autres comptes ailleurs)

Merci à Kaza, Vincent Scalera et moi ( oui parce que j'aime bien m'auto remercier ) pour l'écriture.
Merci encore à Vincent pour la réalisation
Et à Jonathan Chiche pour le rôle de sa vie qui lui vaudra un jour l'oscar du meilleur interprete sexy et masculin, celui d'Etiene Gasoil avec un W
Cette vidéo contient OF COURSE un plassman 2 prodwui passke ioutub monay ta vu. Mais au moins vous avez une vidéo propre et sans pub au début, donc tou lmonde é contan :)

Si t'as lu jusqu'ici commente "" Etiene t tro bô"" pour qu'il le sache. parce que je crois qu'il a un doute.
Bisous bisous !",ANDY,2016-09-18T15:00:05Z,"['andy', 'andy raconte', 'andyraconte', 'profs', 'rentrée', 'code des profs', 'vidéo', 'youtube']",23,4:55,1196,273215,11841949,0,hd,True
Quand une Chieuse regarde le Foot - Andy,"Allez Zizou !!!!!!

Abonne toi c'est gratuit ;) Pour une fois que quelque chose est gratuit sérieux ça serait con de louper ça ! 

Suis moi sur Facebook ! http://www.facebook.com/andyraconte
Twitter :   @andyrowski
Et sur Insta ! @andyrowski
Et NOOON je n'ai pas Snapchat ;) (Ni d'autres comptes ailleurs)

Beusouuuuuus !!!!",ANDY,2016-06-15T14:00:07Z,"['foot', 'euro2016', 'andy', 'humour', ""coupe d'europe""]",23,3:36,1547,172152,5046892,0,hd,True
Etre Frère et Soeur - Andy,"Il est temps de vous présenter celui qui à créé la chieuse. 15 ans à vivre à ses côtés, ça laisse des séquelles. 

Abonne toi c'est gratuit ;) Pour une fois que quelque chose est gratuit sérieux ça serait con de louper ça ! 

Merci à mon frère Yann ( en même temps c'était son idée de faire cette vidéo, c'est lui qui devrait me remercier en fait ) et à Ibi dont on entend la voix de temps en temps (il s'est incrusté j'avais pas le choix)

Suis moi sur Facebook ! http://www.facebook.com/andyraconte
Twitter :   @andyrowski
Et sur Insta ! @andyrowski
Et NOOON je n'ai pas Snapchat ;) (Ni d'autres comptes ailleurs)

Dates des dédicaces restantes :


-STRASBOURG : Le 21 MAI à la librairie Kleber 14-17h
-BRUXELLES : Le 28 MAI à la librairie Filigranes 14-17h
-NANTES : Le 4 JUIN a l'espace culturel de Leclerc Basse Goulaine 14-17h

Beusouuuuuus !!!!",ANDY,2016-05-11T16:00:28Z,"['andy', 'andy raconte', 'frère et soeur', 'famille', 'vidéo', 'humour', 'youtube', 'podcast']",23,,-1,302519,7767426,0,hd,True
Les faux compliments - Andy,"Quand on te fais un compliment mais qu'au final tu viens de te prendre une vieille claque en pleine tête !! 

Abonne toi c'est gratuit ;) Pour une fois que quelque chose est gratuit sérieux ça serait con de louper ça ! 

Suis moi sur Facebook ! http://www.facebook.com/andyraconte
Twitter :   @andyrowski
Et sur Insta ! @andyrowski
Et NOOON je n'ai pas Snapchat ;) (Ni d'autres comptes ailleurs)

Dates des dédicaces restantes :

-STRASBOURG : Le 21 MAI à la librairie Kleber 14-17h
-BRUXELLES : Le 28 MAI à la librairie Filigranes 14-17h
-NANTES : Le 4 JUIN a l'espace culturel de Leclerc Basse Goulaine

Beusouuuuuus !!!!",ANDY,2016-04-20T16:00:19Z,"['andy', 'andy raconte', 'vidéo', 'compliments', 'faux compliments']",23,3:16,-1,218640,6420386,0,hd,True
